{
  "artifact": {
    "artifact_id": "CORE.CODEX.PhoenixSchema.GCDB",
    "official_name": "phoenix_gcdb.registry.json",
    "canonical_version": "v16.0",
    "source_artifact": "CORE.CODEX.PhoenixSchema",
    "registry_type": "Governance Configuration Database",
    "lifecycle_state": "ACTIVE",
    "canonization_state": "CANONIZED"
  },
  "governance_model": {
    "object_types": [
      "POLICY",
      "CONTROL",
      "EXCEPTION",
      "FINDING",
      "VERIFICATION",
      "EVIDENCE",
      "RISK",
      "METRIC"
    ],
    "compliance_status_values": [
      "COMPLIANT",
      "PARTIAL",
      "NON_COMPLIANT",
      "EXEMPT",
      "UNDER_REMEDIATION"
    ],
    "status_derivation": "Policy status is derived from active findings and scoped exceptions. Findings dominate unless an exception exists; finding plus exception becomes UNDER_REMEDIATION."
  },
  "implementation_context": {
    "deployment_target": "PRSVM Core Platform / local workstation first; Kubernetes capabilities are conditional extensions.",
    "current_server_version": "v3.9.0 review context",
    "compliance_posture": "The contract defines target governance. implementation_gaps records known places where the current server does not yet satisfy the target."
  },
  "policies": [
    {
      "id": "LAW-001",
      "object_type": "POLICY",
      "domain": "resilience-and-remediation",
      "intent": "Friction creates Form; moving from static perfection to dynamic resilience.",
      "principle": "Chaos Engineering",
      "severity": "MUST",
      "target_state": "External API and internal module calls must use circuit breakers with fallback states.",
      "current_state": "No reviewed non-compliance recorded in the v3.9.0 implementation context.",
      "compliance_status": "COMPLIANT",
      "owner": "Resilience Engineering",
      "control_refs": [
        "CTRL-L001"
      ],
      "test_refs": [
        "TEST-L001"
      ],
      "finding_refs": [],
      "exception_refs": [],
      "evidence_refs": [
        "EVD-002"
      ],
      "dependencies": [
        "AOP-CERBERUS-002",
        "observability.metrics.failure_rate"
      ],
      "lifecycle_state": "ACTIVE"
    },
    {
      "id": "LAW-002",
      "object_type": "POLICY",
      "domain": "identity-and-traceability",
      "intent": "A name is the first thread in the weave of being; formal, indexable identity.",
      "principle": "Content-Addressable Storage",
      "severity": "MUST",
      "target_state": "Generated artifacts require a SHA-256 semantic content hash and a valid UIP vector signature.",
      "current_state": "No reviewed non-compliance recorded in the v3.9.0 implementation context.",
      "compliance_status": "COMPLIANT",
      "owner": "Governance Registry",
      "control_refs": [
        "CTRL-L002"
      ],
      "test_refs": [
        "TEST-L002"
      ],
      "finding_refs": [],
      "exception_refs": [],
      "evidence_refs": [
        "EVD-002"
      ],
      "dependencies": [
        "UIP vector signature",
        "canonical_identity.rego"
      ],
      "lifecycle_state": "ACTIVE"
    },
    {
      "id": "LAW-003",
      "object_type": "POLICY",
      "domain": "identity-and-traceability",
      "intent": "Truth exists in the superposition of possibilities until observed.",
      "principle": "Quantum Logic Gating",
      "severity": "MUST",
      "target_state": "Candidate seeds must remain gated until probabilistic spread falls below the consensus threshold; ungated promotion is prohibited.",
      "current_state": "No reviewed non-compliance recorded in the v3.9.0 implementation context.",
      "compliance_status": "COMPLIANT",
      "owner": "Consensus Engine",
      "control_refs": [
        "CTRL-L003"
      ],
      "test_refs": [
        "TEST-L003"
      ],
      "finding_refs": [],
      "exception_refs": [],
      "evidence_refs": [
        "EVD-002"
      ],
      "dependencies": [
        "probabilistic_consensus.rego",
        "Superposition_Fault gating"
      ],
      "lifecycle_state": "ACTIVE"
    },
    {
      "id": "LAW-004",
      "object_type": "POLICY",
      "domain": "identity-and-traceability",
      "intent": "Knowledge does not exist until it is woven.",
      "principle": "Graph Topology",
      "severity": "MUST",
      "target_state": "New artifacts must contain at least one verified bidirectional graph pointer.",
      "current_state": "FINALIZE_PROPOSAL creates parent_hash but no reverse graph edge.",
      "compliance_status": "NON_COMPLIANT",
      "owner": "Knowledge Graph",
      "control_refs": [
        "CTRL-L004",
        "CTRL-007"
      ],
      "test_refs": [
        "TEST-L004",
        "TEST-R001"
      ],
      "finding_refs": [
        "FND-002"
      ],
      "exception_refs": [],
      "evidence_refs": [
        "EVD-002",
        "EVD-005"
      ],
      "dependencies": [
        "GUCA-LINK-001",
        "graph_connectivity.rego"
      ],
      "lifecycle_state": "ACTIVE"
    },
    {
      "id": "LAW-005",
      "object_type": "POLICY",
      "domain": "grounded-intelligence",
      "intent": "Single-vector answers are forbidden.",
      "principle": "Multi-Agent Triangulation",
      "severity": "MUST",
      "target_state": "High-stakes queries require consensus from at least three distinct retrieval or reasoning shards.",
      "current_state": "No reviewed non-compliance recorded in the v3.9.0 implementation context.",
      "compliance_status": "COMPLIANT",
      "owner": "CSE Consensus Engine",
      "control_refs": [
        "CTRL-L005"
      ],
      "test_refs": [
        "TEST-L005"
      ],
      "finding_refs": [],
      "exception_refs": [],
      "evidence_refs": [
        "EVD-002"
      ],
      "dependencies": [
        "agent_triangulation.rego"
      ],
      "lifecycle_state": "ACTIVE"
    },
    {
      "id": "LAW-006",
      "object_type": "POLICY",
      "domain": "grounded-intelligence",
      "intent": "The System does not guess; it synthesizes.",
      "principle": "RAG Strict Grounding",
      "severity": "MUST",
      "target_state": "Generation is halted when retrieved context cosine similarity is below 0.85.",
      "current_state": "No reviewed non-compliance recorded in the v3.9.0 implementation context.",
      "compliance_status": "COMPLIANT",
      "owner": "Retrieval Layer",
      "control_refs": [
        "CTRL-L006",
        "CTRL-010"
      ],
      "test_refs": [
        "TEST-L006",
        "TEST-R004"
      ],
      "finding_refs": [],
      "exception_refs": [],
      "evidence_refs": [
        "EVD-002"
      ],
      "dependencies": [
        "GUCA Command Registry semver pin: CMD.RequestClarification@^1.0.0",
        "grounding_threshold.rego"
      ],
      "lifecycle_state": "ACTIVE"
    },
    {
      "id": "LAW-007",
      "object_type": "POLICY",
      "domain": "policy-and-access",
      "intent": "Form is the vessel of Truth.",
      "principle": "Strict Schema Validation",
      "severity": "MUST",
      "target_state": "Artifacts must pass canonical schema validation and strict type checks before acceptance.",
      "current_state": "No reviewed non-compliance recorded in the v3.9.0 implementation context.",
      "compliance_status": "COMPLIANT",
      "owner": "Schema Steward",
      "control_refs": [
        "CTRL-L007"
      ],
      "test_refs": [
        "TEST-L007"
      ],
      "finding_refs": [],
      "exception_refs": [],
      "evidence_refs": [
        "EVD-002"
      ],
      "dependencies": [
        "AOP-PGPS-001",
        "schema_enforcement.rego"
      ],
      "lifecycle_state": "ACTIVE"
    },
    {
      "id": "LAW-008",
      "object_type": "POLICY",
      "domain": "evolution-and-operations",
      "intent": "Stagnation is Dissonance.",
      "principle": "AST Auto-Refactoring",
      "severity": "SHOULD",
      "target_state": "Scheduled analysis detects dead code, deprecated protocol references, and unused variables.",
      "current_state": "No reviewed non-compliance recorded in the v3.9.0 implementation context.",
      "compliance_status": "COMPLIANT",
      "owner": "Evolution Agent",
      "control_refs": [
        "CTRL-L008"
      ],
      "test_refs": [
        "TEST-L008"
      ],
      "finding_refs": [],
      "exception_refs": [],
      "evidence_refs": [
        "EVD-002"
      ],
      "dependencies": [
        "AOP-PERPETUAL-COHERENCE-001",
        "evolution_cadence.rego"
      ],
      "lifecycle_state": "ACTIVE"
    },
    {
      "id": "LAW-009",
      "object_type": "POLICY",
      "domain": "evolution-and-operations",
      "intent": "Signal over Noise; high-density operational states.",
      "principle": "CQRS Segregation",
      "severity": "SHOULD",
      "target_state": "Read operations use query views and write operations use a validated command path.",
      "current_state": "No reviewed non-compliance recorded in the v3.9.0 implementation context.",
      "compliance_status": "COMPLIANT",
      "owner": "Platform Architecture",
      "control_refs": [
        "CTRL-L009"
      ],
      "test_refs": [
        "TEST-L009"
      ],
      "finding_refs": [],
      "exception_refs": [],
      "evidence_refs": [
        "EVD-002"
      ],
      "dependencies": [
        "Materialized View Queue",
        "segregation_access.rego"
      ],
      "lifecycle_state": "ACTIVE"
    },
    {
      "id": "LAW-010",
      "object_type": "POLICY",
      "domain": "identity-and-traceability",
      "intent": "Never Destroy; Only Deprecate.",
      "principle": "Tombstone Versioning",
      "severity": "MUST",
      "target_state": "Delete operations are revoked; deprecation writes a tombstone and successor pointer.",
      "current_state": "No reviewed non-compliance recorded in the v3.9.0 implementation context.",
      "compliance_status": "COMPLIANT",
      "owner": "Data Governance",
      "control_refs": [
        "CTRL-L010",
        "CTRL-010"
      ],
      "test_refs": [